{
  "schema_version": 1,
  "inventory_version": 1,
  "release_id": "2.0.0-dev",
  "browser_lanes": [
    {
      "family": "chromium",
      "exact_build": "150.0.7871.124",
      "platform": "darwin-arm64",
      "binary_sha256": "22ddf33cec88bbfd181588eb3da31250a65ba8ebfdb6efcd2694a36275697284"
    },
    {
      "family": "firefox",
      "exact_build": "152.0.6",
      "platform": "darwin-arm64",
      "binary_sha256": "8489f35e3b2ee8b7ca8aaa34ae0762d3faa884ccef8cbeecfad0cae213b7c0e7"
    }
  ],
  "policy_exception": {
    "boundary": "synchronous",
    "name": "NotSupportedError",
    "message_suffix": " is disabled by ZeroProxy policy"
  },
  "packet_test_id": "emerging-capability-zero-egress-v1",
  "permissions_policy_features": [
    "attribution-reporting",
    "bluetooth",
    "browsing-topics",
    "camera",
    "digital-credentials-get",
    "display-capture",
    "geolocation",
    "hid",
    "identity-credentials-get",
    "join-ad-interest-group",
    "microphone",
    "nfc",
    "payment",
    "private-aggregation",
    "publickey-credentials-create",
    "publickey-credentials-get",
    "run-ad-auction",
    "serial",
    "speaker-selection",
    "usb",
    "web-share"
  ],
  "capabilities": [
    {
      "id": "fedcm-identity-credential",
      "category": "federated-identity",
      "binding": {
        "kind": "global",
        "name": "IdentityCredential"
      },
      "realms": [
        "document"
      ],
      "disposition": "disabled",
      "behaviors": [
        {
          "realm": "document",
          "boundary": "synchronous",
          "exception": "NotSupportedError"
        }
      ],
      "packet_test_id": "emerging-capability-zero-egress-v1",
      "native_presence": {
        "chromium": true,
        "firefox": false
      }
    },
    {
      "id": "fedcm-federated-credential",
      "category": "federated-identity",
      "binding": {
        "kind": "global",
        "name": "FederatedCredential"
      },
      "realms": [
        "document"
      ],
      "disposition": "disabled",
      "behaviors": [
        {
          "realm": "document",
          "boundary": "synchronous",
          "exception": "NotSupportedError"
        }
      ],
      "packet_test_id": "emerging-capability-zero-egress-v1",
      "native_presence": {
        "chromium": true,
        "firefox": false
      }
    },
    {
      "id": "credential-password",
      "category": "federated-identity",
      "binding": {
        "kind": "global",
        "name": "PasswordCredential"
      },
      "realms": [
        "document"
      ],
      "disposition": "disabled",
      "behaviors": [
        {
          "realm": "document",
          "boundary": "synchronous",
          "exception": "NotSupportedError"
        }
      ],
      "packet_test_id": "emerging-capability-zero-egress-v1",
      "native_presence": {
        "chromium": true,
        "firefox": false
      }
    },
    {
      "id": "credential-container-get",
      "category": "federated-identity",
      "binding": {
        "kind": "prototype-method",
        "owner": "CredentialsContainer",
        "member": "get"
      },
      "realms": [
        "document"
      ],
      "disposition": "disabled",
      "behaviors": [
        {
          "realm": "document",
          "boundary": "synchronous",
          "exception": "NotSupportedError"
        }
      ],
      "packet_test_id": "emerging-capability-zero-egress-v1",
      "native_presence": {
        "chromium": true,
        "firefox": true
      }
    },
    {
      "id": "credential-container-create",
      "category": "federated-identity",
      "binding": {
        "kind": "prototype-method",
        "owner": "CredentialsContainer",
        "member": "create"
      },
      "realms": [
        "document"
      ],
      "disposition": "disabled",
      "behaviors": [
        {
          "realm": "document",
          "boundary": "synchronous",
          "exception": "NotSupportedError"
        }
      ],
      "packet_test_id": "emerging-capability-zero-egress-v1",
      "native_presence": {
        "chromium": true,
        "firefox": true
      }
    },
    {
      "id": "credential-container-store",
      "category": "federated-identity",
      "binding": {
        "kind": "prototype-method",
        "owner": "CredentialsContainer",
        "member": "store"
      },
      "realms": [
        "document"
      ],
      "disposition": "disabled",
      "behaviors": [
        {
          "realm": "document",
          "boundary": "synchronous",
          "exception": "NotSupportedError"
        }
      ],
      "packet_test_id": "emerging-capability-zero-egress-v1",
      "native_presence": {
        "chromium": true,
        "firefox": true
      }
    },
    {
      "id": "credential-container-prevent-silent-access",
      "category": "federated-identity",
      "binding": {
        "kind": "prototype-method",
        "owner": "CredentialsContainer",
        "member": "preventSilentAccess"
      },
      "realms": [
        "document"
      ],
      "disposition": "disabled",
      "behaviors": [
        {
          "realm": "document",
          "boundary": "synchronous",
          "exception": "NotSupportedError"
        }
      ],
      "packet_test_id": "emerging-capability-zero-egress-v1",
      "native_presence": {
        "chromium": true,
        "firefox": true
      }
    },
    {
      "id": "fedcm-disconnect",
      "category": "federated-identity",
      "binding": {
        "kind": "static-method",
        "owner": "IdentityCredential",
        "member": "disconnect"
      },
      "realms": [
        "document"
      ],
      "disposition": "disabled",
      "behaviors": [
        {
          "realm": "document",
          "boundary": "synchronous",
          "exception": "NotSupportedError"
        }
      ],
      "packet_test_id": "emerging-capability-zero-egress-v1",
      "native_presence": {
        "chromium": true,
        "firefox": false
      }
    },
    {
      "id": "fedcm-login-status",
      "category": "federated-identity",
      "binding": {
        "kind": "prototype-method",
        "owner": "NavigatorLogin",
        "member": "setStatus"
      },
      "realms": [
        "document"
      ],
      "disposition": "disabled",
      "behaviors": [
        {
          "realm": "document",
          "boundary": "synchronous",
          "exception": "NotSupportedError"
        }
      ],
      "packet_test_id": "emerging-capability-zero-egress-v1",
      "native_presence": {
        "chromium": true,
        "firefox": true
      }
    },
    {
      "id": "payment-request",
      "category": "payments",
      "binding": {
        "kind": "global",
        "name": "PaymentRequest"
      },
      "realms": [
        "document"
      ],
      "disposition": "disabled",
      "behaviors": [
        {
          "realm": "document",
          "boundary": "synchronous",
          "exception": "NotSupportedError"
        }
      ],
      "packet_test_id": "emerging-capability-zero-egress-v1",
      "native_presence": {
        "chromium": true,
        "firefox": false
      }
    },
    {
      "id": "payment-manager-delegations",
      "category": "payments",
      "binding": {
        "kind": "prototype-method",
        "owner": "PaymentManager",
        "member": "enableDelegations"
      },
      "realms": [
        "target-service-worker"
      ],
      "disposition": "disabled",
      "behaviors": [
        {
          "realm": "target-service-worker",
          "boundary": "promise-rejection",
          "exception": "NotSupportedError"
        }
      ],
      "packet_test_id": "emerging-capability-zero-egress-v1",
      "native_presence": {
        "chromium": true,
        "firefox": false
      }
    },
    {
      "id": "payment-instruments-clear",
      "category": "payments",
      "binding": {
        "kind": "prototype-method",
        "owner": "PaymentInstruments",
        "member": "clear"
      },
      "realms": [
        "target-service-worker"
      ],
      "disposition": "disabled",
      "behaviors": [
        {
          "realm": "target-service-worker",
          "boundary": "promise-rejection",
          "exception": "NotSupportedError"
        }
      ],
      "packet_test_id": "emerging-capability-zero-egress-v1",
      "native_presence": {
        "chromium": false,
        "firefox": false
      }
    },
    {
      "id": "payment-instruments-delete",
      "category": "payments",
      "binding": {
        "kind": "prototype-method",
        "owner": "PaymentInstruments",
        "member": "delete"
      },
      "realms": [
        "target-service-worker"
      ],
      "disposition": "disabled",
      "behaviors": [
        {
          "realm": "target-service-worker",
          "boundary": "promise-rejection",
          "exception": "NotSupportedError"
        }
      ],
      "packet_test_id": "emerging-capability-zero-egress-v1",
      "native_presence": {
        "chromium": false,
        "firefox": false
      }
    },
    {
      "id": "payment-instruments-get",
      "category": "payments",
      "binding": {
        "kind": "prototype-method",
        "owner": "PaymentInstruments",
        "member": "get"
      },
      "realms": [
        "target-service-worker"
      ],
      "disposition": "disabled",
      "behaviors": [
        {
          "realm": "target-service-worker",
          "boundary": "promise-rejection",
          "exception": "NotSupportedError"
        }
      ],
      "packet_test_id": "emerging-capability-zero-egress-v1",
      "native_presence": {
        "chromium": false,
        "firefox": false
      }
    },
    {
      "id": "payment-instruments-has",
      "category": "payments",
      "binding": {
        "kind": "prototype-method",
        "owner": "PaymentInstruments",
        "member": "has"
      },
      "realms": [
        "target-service-worker"
      ],